{
  "schema_version": 1,
  "pack": {
    "name": "codex-executive-skill-pack",
    "version": "0.1.0",
    "maturity": "instruction-audited",
    "runtime_status": "host-dependent",
    "skill_count": 20,
    "explicit_only_count": 9,
    "license": "MIT",
    "public_boundary": "No account credentials, private paths, personal profiles, production connectors, or hidden autonomy are included.",
    "routing_minimum_score": 6
  },
  "layers": [
    {
      "id": "intelligence",
      "label": "Layer 1 — Intelligence",
      "skill_count": 4
    },
    {
      "id": "engineering-execution",
      "label": "Layer 2 — Engineering & Execution",
      "skill_count": 6
    },
    {
      "id": "decision-learning",
      "label": "Layer 3 — Decision & Learning",
      "skill_count": 5
    },
    {
      "id": "orchestration-operations",
      "label": "Layer 4 — Orchestration & Operations",
      "skill_count": 5
    }
  ],
  "skills": [
    {
      "id": 1,
      "name": "web-intel-harvester",
      "display_name": "Web Intel Harvester",
      "layer": "intelligence",
      "purpose": "Collect public web evidence into a structured, cited source pack before analysis begins.",
      "description": "Collect and normalize public web evidence into a cited source pack. Use when a task requires multi-source online research, primary-source verification, freshness checks, or a reusable evidence ledger; do not use for summarizing text already supplied by the user.",
      "explicit_only": false,
      "risk": "low",
      "permissions": [
        "network_read",
        "local_write_optional"
      ],
      "inputs": [
        "research question and decision context",
        "time window and geography",
        "source-quality requirements",
        "exclusions and evidence format"
      ],
      "outputs": [
        "source ledger with retrieval dates",
        "claim-to-source map",
        "fact/inference separation",
        "coverage gaps and unresolved conflicts"
      ],
      "use_when": [
        "The answer depends on multiple current public sources.",
        "Primary sources must be found and compared.",
        "The research should be reusable by another analyst."
      ],
      "avoid_when": [
        "The user already supplied all source text.",
        "The task is creative writing with no research need.",
        "Access would require private accounts that were not authorized."
      ],
      "workflow": [
        "Define the decision question, time boundary, source tiers, and stopping rule.",
        "Build a source map that prioritizes official and primary evidence before commentary.",
        "Collect only the minimum material needed to answer the question; record dates and ownership.",
        "Normalize claims, deduplicate near-identical reports, and preserve conflicting evidence.",
        "Return a source ledger, supported findings, open gaps, and the exact as-of date."
      ],
      "failure_modes": [
        "Treating a search-result snippet as the underlying evidence.",
        "Mixing event date, publication date, and retrieval date.",
        "Hiding source disagreement behind one confident summary."
      ],
      "keywords": [
        "public web research",
        "authoritative sources",
        "source pack",
        "evidence ledger",
        "primary-source verification",
        "cited research"
      ],
      "phrases": [
        "find authoritative sources",
        "build a source pack",
        "research this across the web",
        "collect public evidence",
        "research this market across public sources"
      ],
      "anti_keywords": [
        "summarize this text",
        "rewrite this paragraph"
      ],
      "positive_prompts": [
        "Find authoritative sources on the new rule and build a cited source pack.",
        "Research this market across public sources and separate facts from inference."
      ],
      "negative_prompt": "Summarize the article pasted below without searching elsewhere.",
      "negative_reason": "All relevant text is already supplied; direct summarization is narrower and safer.",
      "maturity": "instruction-audited",
      "runtime_status": "host-dependent",
      "version": "0.1.0"
    },
    {
      "id": 2,
      "name": "change-sentinel",
      "display_name": "Change Sentinel",
      "layer": "intelligence",
      "purpose": "Detect material changes between a defined baseline and an as-of state.",
      "description": "Compare a current state with an explicit baseline and report material changes, confidence, and downstream implications. Use for monitoring policies, products, repositories, markets, documents, or operating metrics over time; do not use when no baseline can be defined.",
      "explicit_only": false,
      "risk": "low",
      "permissions": [
        "network_read_optional",
        "local_read",
        "local_write_optional"
      ],
      "inputs": [
        "baseline snapshot or date",
        "current snapshot or retrieval plan",
        "materiality thresholds",
        "entities and dimensions to monitor"
      ],
      "outputs": [
        "delta ledger",
        "materiality and confidence labels",
        "unchanged-but-important controls",
        "downstream watch items"
      ],
      "use_when": [
        "The user asks what changed since a date or version.",
        "A recurring monitor needs a stable baseline.",
        "A change must be distinguished from noisy rewording."
      ],
      "avoid_when": [
        "There is no defensible baseline.",
        "The task asks only for the current state.",
        "The compared sources use incompatible definitions that cannot be reconciled."
      ],
      "workflow": [
        "Freeze the baseline, current as-of time, entities, and comparison dimensions.",
        "Normalize definitions, units, and document versions before computing differences.",
        "Classify each delta as added, removed, modified, unchanged, or definition-shifted.",
        "Score materiality using user-defined thresholds and explain uncertainty.",
        "Return the delta ledger, causal implications, and next monitoring triggers."
      ],
      "failure_modes": [
        "Calling a source refresh a real-world change.",
        "Comparing values with different units or definitions.",
        "Reporting only changes and omitting important non-changes."
      ],
      "keywords": [
        "what changed",
        "change monitor",
        "baseline comparison",
        "delta report",
        "since last version",
        "material change"
      ],
      "phrases": [
        "compare with the baseline",
        "what changed since",
        "monitor changes to",
        "build a delta report",
        "what changed in"
      ],
      "anti_keywords": [
        "current overview only"
      ],
      "positive_prompts": [
        "What changed in this policy since the March baseline?",
        "Build a delta report comparing the current product page with last month."
      ],
      "negative_prompt": "Give me a current overview of the policy with no historical comparison.",
      "negative_reason": "A current-state research skill is sufficient because no baseline is requested.",
      "maturity": "instruction-audited",
      "runtime_status": "host-dependent",
      "version": "0.1.0"
    },
    {
      "id": 3,
      "name": "competitor-radar",
      "display_name": "Competitor Radar",
      "layer": "intelligence",
      "purpose": "Turn lawful public competitive signals into an evidence-backed strategic view.",
      "description": "Analyze lawful public signals from competitors and adjacent players across products, pricing, hiring, partnerships, distribution, and positioning. Use for competitive-landscape questions and recurring competitor monitoring; never use for intrusion, impersonation, private surveillance, or unsupported intent claims.",
      "explicit_only": false,
      "risk": "medium",
      "permissions": [
        "network_read_optional",
        "local_write_optional"
      ],
      "inputs": [
        "focal organization or product",
        "competitor set or discovery rule",
        "comparison dimensions",
        "time window and decision to support"
      ],
      "outputs": [
        "competitor signal matrix",
        "evidence and confidence labels",
        "strategic hypotheses",
        "watch list and disconfirming signals"
      ],
      "use_when": [
        "A company needs a structured view of rival moves.",
        "Competitive signals must be compared across common dimensions.",
        "The user wants implications rather than a list of news."
      ],
      "avoid_when": [
        "The request involves non-public personal data.",
        "The user asks to infer confidential strategy without evidence.",
        "The task is a broad market-size study without competitor focus."
      ],
      "workflow": [
        "Define the focal decision, competitor inclusion rule, and lawful evidence boundary.",
        "Collect comparable public signals and tag each by source, date, and confidence.",
        "Separate observed actions from hypotheses about intent.",
        "Compare direction, pace, capability, and likely constraints across competitors.",
        "Return strategic implications, counter-explanations, and signals to monitor."
      ],
      "failure_modes": [
        "Equating marketing language with operational capability.",
        "Inferring motive from one isolated signal.",
        "Comparing different product tiers as if they were equivalent."
      ],
      "keywords": [
        "competitor analysis",
        "competitive intelligence",
        "rival moves",
        "competitive landscape",
        "competitor monitoring",
        "pricing comparison"
      ],
      "phrases": [
        "analyze competitor moves",
        "build a competitor radar",
        "compare rival positioning",
        "monitor these competitors",